{"aggregator_timestamp_field":null,"allowed_parameters":["l1_code","l2_code","l3_code","ts_code","is_new"],"api_name":"index_member_all","capability":"exposure_candidates","content_scope":"tushare_index_member_all_private_research","date_fields":["in_date","out_date"],"datetime_fields":[],"documentation_url":"https://tushare.pro/document/2?doc_id=335","fields":["l1_code","l1_name","l2_code","l2_name","l3_code","l3_name","ts_code","name","in_date","out_date","is_new"],"fixed_parameters":{},"license_scope":"private_research_no_redistribution","pagination_max_pages":100,"pagination_page_size":1000,"primary_key_fields":["l3_code","ts_code","in_date"],"publisher_time_field":null,"rights_url":"https://tushare.pro/document/1?doc_id=108","schema_version":"market-impact.tushare-observation-source.v1","semantic_scope":"aggregated_source_observation_actual_receipt_only","source_config_id":"tushare-observation-source-cb2d9820822641ba08283b2e2e6b07cba08eac82d00fad3990ec42c3ee678309","source_id":"tushare-index-member-all","source_timezone":"Asia/Shanghai","upstream_publisher":"Tushare Pro"}
