{"aggregator_timestamp_field":null,"allowed_parameters":["ts_code","trade_date","start_date","end_date"],"api_name":"index_dailybasic","capability":"market_context","content_scope":"tushare_index_dailybasic_private_research","date_fields":["trade_date"],"datetime_fields":[],"documentation_url":"https://tushare.pro/document/2?doc_id=128","fields":["ts_code","trade_date","total_mv","float_mv","total_share","float_share","free_share","turnover_rate","turnover_rate_f","pe","pe_ttm","pb"],"fixed_parameters":{},"license_scope":"private_research_no_redistribution","pagination_max_pages":100,"pagination_page_size":1000,"primary_key_fields":["ts_code","trade_date"],"publisher_time_field":null,"rights_url":"https://tushare.pro/document/1?doc_id=108","schema_version":"market-impact.tushare-observation-source.v1","semantic_scope":"aggregated_source_observation_actual_receipt_only","source_config_id":"tushare-observation-source-062a78175607229bbaca626c1cff04a8741f7f85132b6b1061f0c65a37f4315b","source_id":"tushare-index-dailybasic","source_timezone":"Asia/Shanghai","upstream_publisher":"Tushare Pro"}
