{"aggregator_timestamp_field":null,"allowed_parameters":["ts_code","ann_date","start_date","end_date","period"],"api_name":"express_vip","capability":"event_revelation","content_scope":"tushare_express_vip_private_research","date_fields":["ann_date","end_date"],"datetime_fields":[],"documentation_url":"https://tushare.pro/document/2?doc_id=46","fields":["ts_code","ann_date","end_date","revenue","operate_profit","total_profit","n_income","total_assets","total_hldr_eqy_exc_min_int","diluted_eps","diluted_roe","yoy_net_profit","bps","yoy_sales","yoy_op","yoy_tp","yoy_dedu_np","yoy_eps","yoy_roe","growth_assets","yoy_equity","growth_bps","or_last_year","op_last_year","tp_last_year","np_last_year","eps_last_year","open_net_assets","open_bps","perf_summary","is_audit","remark"],"fixed_parameters":{},"license_scope":"private_research_no_redistribution","pagination_max_pages":100,"pagination_page_size":1000,"primary_key_fields":["ts_code","ann_date","end_date"],"publisher_time_field":null,"rights_url":"https://tushare.pro/document/1?doc_id=108","schema_version":"market-impact.tushare-observation-source.v1","semantic_scope":"aggregated_source_observation_actual_receipt_only","source_config_id":"tushare-observation-source-5cbb4d28b500c2362396620cabeda85cf84397d1aa35027745a166a0614aa40e","source_id":"tushare-express-vip","source_timezone":"Asia/Shanghai","upstream_publisher":"Tushare Pro"}
