{"aggregator_timestamp_field":null,"allowed_parameters":["start_date","end_date"],"api_name":"major_news","capability":"event_revelation","content_scope":"tushare_major_news_private_research","date_fields":[],"datetime_fields":["pub_time"],"documentation_url":"https://tushare.pro/document/2?doc_id=195","fields":["title","content","pub_time","src"],"fixed_parameters":{},"license_scope":"private_research_no_redistribution","pagination_max_pages":100,"pagination_page_size":400,"primary_key_fields":["pub_time","src","title","content"],"publisher_time_field":"pub_time","rights_url":"https://tushare.pro/document/1?doc_id=108","schema_version":"market-impact.tushare-observation-source.v1","semantic_scope":"aggregated_multi_publisher_observation_actual_receipt_only","source_config_id":"tushare-observation-source-151862e4ed1771bef512b697fc46c907cf1b0a6aa198a7e363093ae41f0e73bf","source_id":"tushare-major-news","source_timezone":"Asia/Shanghai","upstream_publisher":"Tushare major news publisher set"}
