{"aggregator_timestamp_field":null,"allowed_parameters":["start_date","end_date"],"api_name":"news","capability":"event_revelation","content_scope":"tushare_news_private_research","date_fields":[],"datetime_fields":["datetime"],"documentation_url":"https://tushare.pro/document/2?doc_id=143","fields":["datetime","content","title","channels"],"fixed_parameters":{"src":"fenghuang"},"license_scope":"private_research_no_redistribution","pagination_max_pages":100,"pagination_page_size":1000,"primary_key_fields":["datetime","title","content"],"publisher_time_field":"datetime","rights_url":"https://tushare.pro/document/1?doc_id=108","schema_version":"market-impact.tushare-observation-source.v1","semantic_scope":"aggregated_source_observation_actual_receipt_only","source_config_id":"tushare-observation-source-6fe55059aa708d8f2a7166214a8cdba545ab57c13d2f09f2d67154b6578f54bc","source_id":"tushare-news-fenghuang","source_timezone":"Asia/Shanghai","upstream_publisher":"Phoenix Finance"}
