{"aggregator_timestamp_field":null,"allowed_parameters":["ts_code","index_code","list_date","list_status","exchange","mgr"],"api_name":"etf_basic","capability":"exposure_candidates","content_scope":"tushare_etf_basic_private_research","date_fields":["setup_date","list_date"],"datetime_fields":[],"documentation_url":"https://tushare.pro/document/2?doc_id=385","fields":["ts_code","csname","extname","cname","index_code","index_name","setup_date","list_date","list_status","exchange","mgr_name","custod_name","mgt_fee","etf_type"],"fixed_parameters":{},"license_scope":"private_research_no_redistribution","pagination_max_pages":100,"pagination_page_size":1000,"primary_key_fields":["ts_code"],"publisher_time_field":null,"rights_url":"https://tushare.pro/document/1?doc_id=108","schema_version":"market-impact.tushare-observation-source.v1","semantic_scope":"aggregated_source_observation_actual_receipt_only","source_config_id":"tushare-observation-source-ca88832aaa477af193b6e2fa75a6ea8015fd2fed41a712391d8cf76da2019099","source_id":"tushare-etf-basic","source_timezone":"Asia/Shanghai","upstream_publisher":"Tushare Pro"}
