{"aggregator_timestamp_field":null,"allowed_parameters":["ts_code","trade_date","start_date","end_date","suspend_type"],"api_name":"suspend_d","capability":"exposure_candidates","content_scope":"tushare_suspend_d_private_research","date_fields":["trade_date"],"datetime_fields":[],"documentation_url":"https://tushare.pro/document/2?doc_id=214","fields":["ts_code","trade_date","suspend_timing","suspend_type"],"fixed_parameters":{},"license_scope":"private_research_no_redistribution","pagination_max_pages":100,"pagination_page_size":1000,"primary_key_fields":["ts_code","trade_date","suspend_type"],"publisher_time_field":null,"rights_url":"https://tushare.pro/document/1?doc_id=108","schema_version":"market-impact.tushare-observation-source.v1","semantic_scope":"aggregated_source_observation_actual_receipt_only","source_config_id":"tushare-observation-source-3ff065aaad4c2a3343c37dae7ce9f9607b013c01e58f4e49f8dcf937580457fa","source_id":"tushare-suspend-d","source_timezone":"Asia/Shanghai","upstream_publisher":"Tushare Pro"}
