{"aggregator_timestamp_field":null,"allowed_parameters":["ts_code","trade_date","start_date","end_date"],"api_name":"daily","capability":"market_context","content_scope":"tushare_daily_private_research","date_fields":["trade_date"],"datetime_fields":[],"documentation_url":"https://tushare.pro/document/1?doc_id=27","fields":["ts_code","trade_date","open","high","low","close","pre_close","change","pct_chg","vol","amount"],"fixed_parameters":{},"license_scope":"private_research_no_redistribution","pagination_max_pages":100,"pagination_page_size":1000,"primary_key_fields":["ts_code","trade_date"],"publisher_time_field":null,"rights_url":"https://tushare.pro/document/1?doc_id=108","schema_version":"market-impact.tushare-observation-source.v1","semantic_scope":"aggregated_source_observation_actual_receipt_only","source_config_id":"tushare-observation-source-5a3abb927de28b3f79ddd716db43ad29a4078699b8d1544ee475543d4c4a0a3f","source_id":"tushare-daily","source_timezone":"Asia/Shanghai","upstream_publisher":"Tushare Pro"}
