{"aggregator_timestamp_field":null,"allowed_parameters":["index_code","level","src"],"api_name":"index_classify","capability":"exposure_candidates","content_scope":"tushare_index_classify_private_research","date_fields":[],"datetime_fields":[],"documentation_url":"https://tushare.pro/document/2?doc_id=181","fields":["index_code","industry_name","parent_code","level","industry_code","is_pub","src"],"fixed_parameters":{},"license_scope":"private_research_no_redistribution","pagination_max_pages":100,"pagination_page_size":1000,"primary_key_fields":["index_code","industry_code","src"],"publisher_time_field":null,"rights_url":"https://tushare.pro/document/1?doc_id=108","schema_version":"market-impact.tushare-observation-source.v1","semantic_scope":"aggregated_source_observation_actual_receipt_only","source_config_id":"tushare-observation-source-663e55e82045d23f3070fa37b33ffd87add946e90e92b0a49c586baf18d1c3dc","source_id":"tushare-index-classify","source_timezone":"Asia/Shanghai","upstream_publisher":"Tushare Pro"}
