{"aggregator_timestamp_field":null,"allowed_parameters":["ts_code","trade_date","start_date","end_date"],"api_name":"adj_factor","capability":"market_context","content_scope":"tushare_adj_factor_private_research","date_fields":["trade_date"],"datetime_fields":[],"documentation_url":"https://tushare.pro/document/2?doc_id=28","fields":["ts_code","trade_date","adj_factor"],"fixed_parameters":{},"license_scope":"private_research_no_redistribution","pagination_max_pages":100,"pagination_page_size":1000,"primary_key_fields":["ts_code","trade_date"],"publisher_time_field":null,"rights_url":"https://tushare.pro/document/1?doc_id=108","schema_version":"market-impact.tushare-observation-source.v1","semantic_scope":"aggregated_source_observation_actual_receipt_only","source_config_id":"tushare-observation-source-554176950e63bae027737203dd632620d7c2ec39f60faa3918dc74315c7b8f83","source_id":"tushare-adj-factor","source_timezone":"Asia/Shanghai","upstream_publisher":"Tushare Pro"}
