{"aggregator_timestamp_field":"create_time","allowed_parameters":["ts_code","report_date","start_date","end_date"],"api_name":"report_rc","capability":"prior_expectation","content_scope":"tushare_report_rc_private_research","date_fields":["report_date"],"datetime_fields":["create_time"],"documentation_url":"https://tushare.pro/document/2?doc_id=292","fields":["ts_code","name","report_date","report_title","report_type","classify","org_name","author_name","quarter","op_rt","op_pr","tp","np","eps","pe","rd","roe","ev_ebitda","rating","max_price","min_price","imp_dg","create_time"],"fixed_parameters":{},"license_scope":"private_research_no_redistribution","pagination_max_pages":100,"pagination_page_size":1000,"primary_key_fields":["ts_code","report_date","org_name","author_name","quarter","report_title"],"publisher_time_field":null,"rights_url":"https://tushare.pro/document/1?doc_id=108","schema_version":"market-impact.tushare-observation-source.v1","semantic_scope":"aggregated_source_observation_actual_receipt_only","source_config_id":"tushare-observation-source-8ef6cf82017c4228508cedf648405f960447632fbd3c1314d80d0bb367be2135","source_id":"tushare-report-rc","source_timezone":"Asia/Shanghai","upstream_publisher":"Tushare Pro"}
