{"aggregator_timestamp_field":null,"allowed_parameters":["ts_code","ann_date","ex_date","pay_date"],"api_name":"fund_div","capability":"market_context","content_scope":"tushare_fund_div_private_research","date_fields":["ann_date","imp_anndate","base_date","record_date","ex_date","pay_date","earpay_date","net_ex_date","account_date"],"datetime_fields":[],"documentation_url":"https://tushare.pro/document/2?doc_id=120","fields":["ts_code","ann_date","imp_anndate","base_date","div_proc","record_date","ex_date","pay_date","earpay_date","net_ex_date","div_cash","base_unit","ear_distr","ear_amount","account_date","base_year"],"fixed_parameters":{},"license_scope":"private_research_no_redistribution","pagination_max_pages":100,"pagination_page_size":1000,"primary_key_fields":["ts_code","ann_date","imp_anndate","base_date","div_proc","record_date","ex_date","pay_date","earpay_date","net_ex_date","div_cash","base_unit","ear_distr","ear_amount","account_date","base_year"],"publisher_time_field":null,"rights_url":"https://tushare.pro/document/1?doc_id=108","schema_version":"market-impact.tushare-observation-source.v1","semantic_scope":"aggregated_source_observation_actual_receipt_only","source_config_id":"tushare-observation-source-9bbb6f2de070222ee81ec0fbf0b32305a059693087d96ed60203d0c84da07f48","source_id":"tushare-fund-div","source_timezone":"Asia/Shanghai","upstream_publisher":"Tushare Pro"}
