{"aggregator_timestamp_field":null,"allowed_parameters":["ts_code","trade_date","start_date","end_date"],"api_name":"daily_basic","capability":"market_context","content_scope":"tushare_daily_basic_private_research","date_fields":["trade_date"],"datetime_fields":[],"documentation_url":"https://tushare.pro/document/2?doc_id=32","fields":["ts_code","trade_date","close","turnover_rate","turnover_rate_f","volume_ratio","pe","pe_ttm","pb","ps","ps_ttm","dv_ratio","dv_ttm","total_share","float_share","free_share","total_mv","circ_mv","limit_status"],"fixed_parameters":{},"license_scope":"private_research_no_redistribution","pagination_max_pages":100,"pagination_page_size":1000,"primary_key_fields":["ts_code","trade_date"],"publisher_time_field":null,"rights_url":"https://tushare.pro/document/1?doc_id=108","schema_version":"market-impact.tushare-observation-source.v1","semantic_scope":"aggregated_source_observation_actual_receipt_only","source_config_id":"tushare-observation-source-e5174c5fd5c95bb1475b196107d130fb2dbb18559017558011e7d6387211aaf2","source_id":"tushare-daily-basic","source_timezone":"Asia/Shanghai","upstream_publisher":"Tushare Pro"}
