{"aggregator_timestamp_field":"time","allowed_parameters":["ts_code","freq"],"api_name":"rt_min","capability":"market_context","content_scope":"tushare_rt_min_private_research","date_fields":[],"datetime_fields":["time"],"documentation_url":"https://tushare.pro/document/2?doc_id=374","fields":["ts_code","time","open","close","high","low","vol","amount"],"fixed_parameters":{},"license_scope":"private_research_no_redistribution","pagination_max_pages":1,"pagination_page_size":1000,"primary_key_fields":["ts_code","time"],"publisher_time_field":null,"rights_url":"https://tushare.pro/document/1?doc_id=108","schema_version":"market-impact.tushare-observation-source.v1","semantic_scope":"aggregated_source_observation_actual_receipt_only","source_config_id":"tushare-observation-source-b655b3e43cef67be0bc6440ea49179d6cc0875f0ede234575678132f0dcf5165","source_id":"tushare-rt-min","source_timezone":"Asia/Shanghai","upstream_publisher":"Tushare Pro"}
