{"aggregator_timestamp_field":null,"allowed_parameters":["ts_code","name","market","list_status","exchange","is_hs"],"api_name":"stock_basic","capability":"exposure_candidates","content_scope":"tushare_stock_basic_private_research","date_fields":["list_date","delist_date"],"datetime_fields":[],"documentation_url":"https://tushare.pro/document/2?doc_id=25","fields":["ts_code","symbol","name","exchange","list_status","list_date","delist_date"],"fixed_parameters":{},"license_scope":"private_research_no_redistribution","pagination_max_pages":100,"pagination_page_size":1000,"primary_key_fields":["ts_code"],"publisher_time_field":null,"rights_url":"https://tushare.pro/document/1?doc_id=108","schema_version":"market-impact.tushare-observation-source.v1","semantic_scope":"aggregated_source_observation_actual_receipt_only","source_config_id":"tushare-observation-source-87df303d7e3fef37a1ef26e5199e0cb106794d7d8881288051c11e4c688fc928","source_id":"tushare-stock-basic","source_timezone":"Asia/Shanghai","upstream_publisher":"Tushare Pro"}
