{"aggregator_timestamp_field":null,"allowed_parameters":["exchange","start_date","end_date","is_open"],"api_name":"trade_cal","capability":"market_context","content_scope":"tushare_trade_cal_private_research","date_fields":["cal_date","pretrade_date"],"datetime_fields":[],"documentation_url":"https://tushare.pro/document/2?doc_id=26","fields":["exchange","cal_date","is_open","pretrade_date"],"fixed_parameters":{},"license_scope":"private_research_no_redistribution","pagination_max_pages":100,"pagination_page_size":1000,"primary_key_fields":["exchange","cal_date"],"publisher_time_field":null,"rights_url":"https://tushare.pro/document/1?doc_id=108","schema_version":"market-impact.tushare-observation-source.v1","semantic_scope":"aggregated_source_observation_actual_receipt_only","source_config_id":"tushare-observation-source-a78581643286cf5cf036991569d79d51a0dfaefedf56755cf72a02c3f638d870","source_id":"tushare-trade-cal","source_timezone":"Asia/Shanghai","upstream_publisher":"Tushare Pro"}
