{"aggregator_timestamp_field":null,"allowed_parameters":["ts_code","market","status"],"api_name":"fund_basic","capability":"exposure_candidates","content_scope":"tushare_fund_basic_private_research","date_fields":["found_date","list_date","delist_date"],"datetime_fields":[],"documentation_url":"https://tushare.pro/document/2?doc_id=19","fields":["ts_code","name","fund_type","found_date","list_date","delist_date","status","market"],"fixed_parameters":{"market":"E"},"license_scope":"private_research_no_redistribution","pagination_max_pages":100,"pagination_page_size":1000,"primary_key_fields":["ts_code"],"publisher_time_field":null,"rights_url":"https://tushare.pro/document/1?doc_id=108","schema_version":"market-impact.tushare-observation-source.v1","semantic_scope":"aggregated_source_observation_actual_receipt_only","source_config_id":"tushare-observation-source-fa08c8f2413c0e4fd1f181e5dbe47f4a21717d25dca8d70138e5bf8bc88722cb","source_id":"tushare-fund-basic","source_timezone":"Asia/Shanghai","upstream_publisher":"Tushare Pro"}
