{"aggregator_timestamp_field":null,"allowed_parameters":["ts_code","trade_date","con_code","start_date","end_date"],"api_name":"etf_sh_cons","capability":"exposure_candidates","content_scope":"tushare_etf_sh_cons_private_research","date_fields":["trade_date"],"datetime_fields":[],"documentation_url":"https://tushare.pro/document/2?doc_id=471","fields":["trade_date","ts_code","con_code","con_name","qty","sub_flag","cpr","rdr","sca","exchange"],"fixed_parameters":{},"license_scope":"private_research_no_redistribution","pagination_max_pages":100,"pagination_page_size":1000,"primary_key_fields":["trade_date","ts_code","con_code"],"publisher_time_field":null,"rights_url":"https://tushare.pro/document/1?doc_id=108","schema_version":"market-impact.tushare-observation-source.v1","semantic_scope":"aggregated_exchange_pcf_actual_receipt_only","source_config_id":"tushare-observation-source-17992fa08c150ba45f5be5eda9c4745a935ddc5dff60f140f2122235b42afcee","source_id":"tushare-etf-sh-cons","source_timezone":"Asia/Shanghai","upstream_publisher":"Tushare Pro"}
