{"aggregator_timestamp_field":null,"allowed_parameters":["start_date","end_date"],"api_name":"news","capability":"event_revelation","content_scope":"tushare_news_private_research","date_fields":[],"datetime_fields":["datetime"],"documentation_url":"https://tushare.pro/document/2?doc_id=143","fields":["datetime","content","title","channels"],"fixed_parameters":{"src":"jinrongjie"},"license_scope":"private_research_no_redistribution","pagination_max_pages":100,"pagination_page_size":1000,"primary_key_fields":["datetime","title","content"],"publisher_time_field":"datetime","rights_url":"https://tushare.pro/document/1?doc_id=108","schema_version":"market-impact.tushare-observation-source.v1","semantic_scope":"aggregated_source_observation_actual_receipt_only","source_config_id":"tushare-observation-source-76ee45f406376f22c228b53baccd219977a785e74dd021d148642cc8049fee44","source_id":"tushare-news-jinrongjie","source_timezone":"Asia/Shanghai","upstream_publisher":"JRJ Finance"}
